{
  "schema_version": "1",
  "policy_version": "mail-fact-gate-v1",
  "result_schema_version": "1",
  "reason_codes": [
    "mail_fact_gate_accepted",
    "mail_fact_gate_acknowledgement_loop",
    "mail_fact_gate_action_invalid",
    "mail_fact_gate_active_fact_invalid",
    "mail_fact_gate_current_plan_missing",
    "mail_fact_gate_dependency_failed",
    "mail_fact_gate_dependency_invalid",
    "mail_fact_gate_dependency_missing",
    "mail_fact_gate_dependency_ready",
    "mail_fact_gate_dependency_requested",
    "mail_fact_gate_dependency_source_missing",
    "mail_fact_gate_fact_candidate_invalid",
    "mail_fact_gate_fact_conflict",
    "mail_fact_gate_fact_identity_ambiguous",
    "mail_fact_gate_fact_not_explicit",
    "mail_fact_gate_fact_scope_invalid",
    "mail_fact_gate_fact_time_invalid",
    "mail_fact_gate_identity_invalid",
    "mail_fact_gate_internal",
    "mail_fact_gate_irrelevant_action",
    "mail_fact_gate_long_term_not_explicit",
    "mail_fact_gate_medical_diagnosis",
    "mail_fact_gate_operator_review_side_effect",
    "mail_fact_gate_plan_action_invalid",
    "mail_fact_gate_plan_constraint_not_explicit",
    "mail_fact_gate_plan_date_not_explicit",
    "mail_fact_gate_plan_request_invalid",
    "mail_fact_gate_policy_unavailable",
    "mail_fact_gate_privileged_claim",
    "mail_fact_gate_privileged_structure",
    "mail_fact_gate_provider_claim_unbound",
    "mail_fact_gate_reason_event_invalid",
    "mail_fact_gate_result_invalid"
  ],
  "limits": {
    "max_result_bytes": 262144,
    "max_json_depth": 8,
    "max_json_nodes": 20000,
    "max_temporary_days": 90
  },
  "intent_actions": {
    "feedback": ["store_only", "reply"],
    "health_or_activity_question": ["reply", "operator_review"],
    "training_question": ["reply", "operator_review"],
    "plan_change_request": ["await_analysis", "reply", "operator_review"],
    "user_fact_update": ["store_only", "reply", "operator_review"],
    "acknowledgement": ["store_only"],
    "non_trainlab_or_unsupported": ["ignore"],
    "safety_concern": ["reply", "operator_review"]
  },
  "fact_keys": {
    "training_goal": {"scopes": ["long_term"], "value_types": ["string"]},
    "training_preference": {"scopes": ["temporary", "long_term"], "value_types": ["string"]},
    "availability": {"scopes": ["temporary", "long_term"], "value_types": ["string"]},
    "schedule_constraint": {"scopes": ["temporary", "long_term"], "value_types": ["string"]},
    "equipment_access": {"scopes": ["temporary", "long_term"], "value_types": ["string"]},
    "injury_status": {"scopes": ["temporary"], "value_types": ["string"]},
    "pain_status": {"scopes": ["temporary"], "value_types": ["string"]},
    "recovery_status": {"scopes": ["temporary"], "value_types": ["string"]},
    "training_note": {"scopes": ["message_only"], "value_types": ["string"]}
  },
  "long_term_markers": [
    "long term",
    "from now on",
    "going forward",
    "permanently",
    "always",
    "my goal is",
    "长期",
    "以后",
    "固定",
    "长期目标",
    "目标改为"
  ],
  "supersession_markers": [
    "now",
    "change",
    "changed",
    "update",
    "updated",
    "instead",
    "no longer",
    "recovered",
    "resolved",
    "改为",
    "现在",
    "更新",
    "不再",
    "已经恢复",
    "已恢复"
  ],
  "forbidden_fact_prefixes": [
    "garmin_",
    "provider_",
    "diagnosis_",
    "medical_",
    "recipient_",
    "gmail_",
    "tool_",
    "plan_write_",
    "analysis_"
  ],
  "medical_diagnosis_phrases": [
    "you are diagnosed",
    "you have arthritis",
    "you have a fracture",
    "this confirms",
    "medical diagnosis",
    "diagnosed with",
    "你被诊断",
    "你患有",
    "确诊为",
    "这证明你"
  ],
  "medical_condition_terms": [
    "arthritis",
    "fracture",
    "tendinitis",
    "tendonitis",
    "sprain",
    "infection",
    "disease",
    "syndrome",
    "concussion",
    "cancer",
    "diabetes",
    "关节炎",
    "骨折",
    "肌腱炎",
    "扭伤",
    "感染",
    "综合征",
    "脑震荡",
    "癌症",
    "糖尿病"
  ],
  "provider_markers": [
    "garmin",
    "provider",
    "device data",
    "watch data",
    "设备数据",
    "手表数据"
  ],
  "provider_metric_terms": [
    "vo2",
    "heart rate",
    "resting heart rate",
    "distance",
    "elapsed",
    "timer",
    "sleep",
    "hydration",
    "intensity",
    "steps",
    "sport",
    "心率",
    "距离",
    "时长",
    "睡眠",
    "饮水",
    "强度",
    "步数"
  ],
  "provider_limitation_markers": [
    "unavailable",
    "not available",
    "missing",
    "no data",
    "cannot verify",
    "不可用",
    "缺少",
    "没有数据",
    "无法核实"
  ],
  "privileged_claim_phrases": [
    "i changed your plan",
    "i updated your plan",
    "your plan has been changed",
    "your plan is now updated",
    "i sent the email",
    "i changed the recipient",
    "我已修改你的计划",
    "计划已经修改",
    "计划已更新",
    "我已经发送邮件",
    "我已更改收件人"
  ],
  "forbidden_structured_keys": [
    "recipient",
    "to",
    "cc",
    "bcc",
    "tool",
    "tool_name",
    "command",
    "label",
    "labels",
    "gmail_action",
    "plan_write",
    "update_plan",
    "training_plan_write",
    "analysis_write"
  ],
  "plan_constraint_keys": [
    "date",
    "from_date",
    "to_date",
    "activity_kind",
    "availability",
    "reason",
    "preference",
    "injury",
    "details"
  ]
}
